[
    {
        "id": "3662879",
        "name": "(2014 DV110)",
        "is_potentially_hazardous": false,
        "estimated_diameter_meters": 45.03,
        "velocity_km_per_sec": 14.38,
        "orbiting_body": "Earth"
    },
    {
        "id": "3838020",
        "name": "(2019 BT2)",
        "is_potentially_hazardous": true,
        "estimated_diameter_meters": 341.62,
        "velocity_km_per_sec": 19.73,
        "orbiting_body": "Earth"
    },
    {
        "id": "3842692",
        "name": "(2019 LV)",
        "is_potentially_hazardous": false,
        "estimated_diameter_meters": 60.47,
        "velocity_km_per_sec": 4.4,
        "orbiting_body": "Earth"
    },
    {
        "id": "3689273",
        "name": "(2014 SU1)",
        "is_potentially_hazardous": false,
        "estimated_diameter_meters": 43.81,
        "velocity_km_per_sec": 17.08,
        "orbiting_body": "Earth"
    },
    {
        "id": "3772976",
        "name": "(2017 FF101)",
        "is_potentially_hazardous": false,
        "estimated_diameter_meters": 67.85,
        "velocity_km_per_sec": 6.92,
        "orbiting_body": "Earth"
    },
    {
        "id": "3841509",
        "name": "(2019 HE)",
        "is_potentially_hazardous": false,
        "estimated_diameter_meters": 19.66,
        "velocity_km_per_sec": 8.74,
        "orbiting_body": "Earth"
    },
    {
        "id": "3046149",
        "name": "(2000 RE52)",
        "is_potentially_hazardous": false,
        "estimated_diameter_meters": 147.08,
        "velocity_km_per_sec": 17.52,
        "orbiting_body": "Earth"
    },
    {
        "id": "3459879",
        "name": "(2001 SL264)",
        "is_potentially_hazardous": false,
        "estimated_diameter_meters": 408.83,
        "velocity_km_per_sec": 1.68,
        "orbiting_body": "Earth"
    },
    {
        "id": "3385827",
        "name": "(2007 SV1)",
        "is_potentially_hazardous": false,
        "estimated_diameter_meters": 49.38,
        "velocity_km_per_sec": 18.68,
        "orbiting_body": "Earth"
    },
    {
        "id": "3556968",
        "name": "(2011 CT4)",
        "is_potentially_hazardous": true,
        "estimated_diameter_meters": 335.38,
        "velocity_km_per_sec": 22.17,
        "orbiting_body": "Earth"
    },
    {
        "id": "3672731",
        "name": "(2014 KO62)",
        "is_potentially_hazardous": false,
        "estimated_diameter_meters": 24.75,
        "velocity_km_per_sec": 3.96,
        "orbiting_body": "Earth"
    },
    {
        "id": "3766132",
        "name": "(2016 YP4)",
        "is_potentially_hazardous": false,
        "estimated_diameter_meters": 17.12,
        "velocity_km_per_sec": 7.48,
        "orbiting_body": "Earth"
    },
    {
        "id": "3799705",
        "name": "(2018 DM)",
        "is_potentially_hazardous": false,
        "estimated_diameter_meters": 68.16,
        "velocity_km_per_sec": 11.61,
        "orbiting_body": "Earth"
    },
    {
        "id": "3827321",
        "name": "(2018 RD2)",
        "is_potentially_hazardous": false,
        "estimated_diameter_meters": 16.5,
        "velocity_km_per_sec": 9.58,
        "orbiting_body": "Earth"
    },
    {
        "id": "3842911",
        "name": "(2019 LL6)",
        "is_potentially_hazardous": false,
        "estimated_diameter_meters": 326.24,
        "velocity_km_per_sec": 13.69,
        "orbiting_body": "Earth"
    },
    {
        "id": "3752409",
        "name": "(2016 HF2)",
        "is_potentially_hazardous": false,
        "estimated_diameter_meters": 25.91,
        "velocity_km_per_sec": 18.33,
        "orbiting_body": "Earth"
    },
    {
        "id": "3836756",
        "name": "(2018 XF2)",
        "is_potentially_hazardous": false,
        "estimated_diameter_meters": 23.63,
        "velocity_km_per_sec": 21.6,
        "orbiting_body": "Earth"
    },
    {
        "id": "3843480",
        "name": "(2019 PM)",
        "is_potentially_hazardous": false,
        "estimated_diameter_meters": 85.81,
        "velocity_km_per_sec": 13.32,
        "orbiting_body": "Earth"
    },
    {
        "id": "2337075",
        "name": "337075 (1998 QC1)",
        "is_potentially_hazardous": true,
        "estimated_diameter_meters": 469.4,
        "velocity_km_per_sec": 23.31,
        "orbiting_body": "Earth"
    },
    {
        "id": "3646736",
        "name": "(2013 QF11)",
        "is_potentially_hazardous": false,
        "estimated_diameter_meters": 51.71,
        "velocity_km_per_sec": 17.92,
        "orbiting_body": "Earth"
    },
    {
        "id": "3691849",
        "name": "(2014 SF304)",
        "is_potentially_hazardous": false,
        "estimated_diameter_meters": 14.91,
        "velocity_km_per_sec": 20.46,
        "orbiting_body": "Earth"
    },
    {
        "id": "3703077",
        "name": "(2014 YT34)",
        "is_potentially_hazardous": false,
        "estimated_diameter_meters": 49.38,
        "velocity_km_per_sec": 6.45,
        "orbiting_body": "Earth"
    },
    {
        "id": "3712669",
        "name": "(2015 DM215)",
        "is_potentially_hazardous": false,
        "estimated_diameter_meters": 62.16,
        "velocity_km_per_sec": 14.2,
        "orbiting_body": "Earth"
    },
    {
        "id": "3781304",
        "name": "(2017 QB35)",
        "is_potentially_hazardous": false,
        "estimated_diameter_meters": 5.94,
        "velocity_km_per_sec": 8.91,
        "orbiting_body": "Earth"
    },
    {
        "id": "3842887",
        "name": "(2019 LL5)",
        "is_potentially_hazardous": false,
        "estimated_diameter_meters": 834.72,
        "velocity_km_per_sec": 18.23,
        "orbiting_body": "Earth"
    },
    {
        "id": "2186822",
        "name": "186822 (2004 FE31)",
        "is_potentially_hazardous": false,
        "estimated_diameter_meters": 1184.52,
        "velocity_km_per_sec": 11.29,
        "orbiting_body": "Earth"
    },
    {
        "id": "2246138",
        "name": "246138 (2007 OG3)",
        "is_potentially_hazardous": false,
        "estimated_diameter_meters": 962.81,
        "velocity_km_per_sec": 4.9,
        "orbiting_body": "Earth"
    },
    {
        "id": "3402204",
        "name": "(2008 CE22)",
        "is_potentially_hazardous": false,
        "estimated_diameter_meters": 22.57,
        "velocity_km_per_sec": 14.2,
        "orbiting_body": "Earth"
    },
    {
        "id": "3408592",
        "name": "(2008 GA4)",
        "is_potentially_hazardous": false,
        "estimated_diameter_meters": 585.52,
        "velocity_km_per_sec": 24.24,
        "orbiting_body": "Earth"
    },
    {
        "id": "3728931",
        "name": "(2015 TH1)",
        "is_potentially_hazardous": false,
        "estimated_diameter_meters": 94.09,
        "velocity_km_per_sec": 8.48,
        "orbiting_body": "Earth"
    },
    {
        "id": "3799798",
        "name": "(2018 EY)",
        "is_potentially_hazardous": false,
        "estimated_diameter_meters": 74.74,
        "velocity_km_per_sec": 13.87,
        "orbiting_body": "Earth"
    },
    {
        "id": "3836114",
        "name": "(2018 VV4)",
        "is_potentially_hazardous": false,
        "estimated_diameter_meters": 20.58,
        "velocity_km_per_sec": 7.48,
        "orbiting_body": "Earth"
    },
    {
        "id": "3330049",
        "name": "(2006 HC2)",
        "is_potentially_hazardous": true,
        "estimated_diameter_meters": 190.35,
        "velocity_km_per_sec": 21.74,
        "orbiting_body": "Earth"
    },
    {
        "id": "3797715",
        "name": "(2018 BX)",
        "is_potentially_hazardous": false,
        "estimated_diameter_meters": 6.51,
        "velocity_km_per_sec": 8.07,
        "orbiting_body": "Earth"
    },
    {
        "id": "3843735",
        "name": "(2019 QL7)",
        "is_potentially_hazardous": false,
        "estimated_diameter_meters": 20.12,
        "velocity_km_per_sec": 20.98,
        "orbiting_body": "Earth"
    }
]